{
  "schema_version": "1.0",
  "request_id": "abl1_supplied_design_v1",
  "mode": "screen",
  "target": "ABL1",
  "input_provenance": "public",
  "compounds": [
    {
      "compound_id": "LT00107",
      "canonical_smiles": "Cc1ccc(NC(=O)c2ccc(CN3CCN(C)CC3)cc2)cc1Nc1nccc(-c2cccnc2)n1",
      "atom_mapped_smiles": "[CH3:1][c:2]1[cH:3][cH:4][c:5]([NH:6][C:7](=[O:8])[c:9]2[cH:10][cH:11][c:12]([CH2:13][N:14]3[CH2:15][CH2:16][N:17]([CH3:18])[CH2:19][CH2:20]3)[cH:21][cH:22]2)[cH:23][c:24]1[NH:25][c:26]1[n:27][cH:28][cH:29][c:30](-[c:31]2[cH:32][cH:33][cH:34][n:35][cH:36]2)[n:37]1",
      "structure_id": "0af895e96bef7b4d06a1e8828b623ba6012a16fe27fa16d2109626cad561b3fd",
      "standardization_version": "dilirank_parent_v1"
    },
    {
      "compound_id": "LT01248",
      "canonical_smiles": "Cc1nc(Nc2ncc(C(=O)Nc3c(C)cccc3Cl)s2)cc(N2CCN(CCO)CC2)n1",
      "atom_mapped_smiles": "[CH3:1][c:2]1[n:3][c:4]([NH:5][c:6]2[n:7][cH:8][c:9]([C:10](=[O:11])[NH:12][c:13]3[c:14]([CH3:15])[cH:16][cH:17][cH:18][c:19]3[Cl:20])[s:21]2)[cH:22][c:23]([N:24]2[CH2:25][CH2:26][N:27]([CH2:28][CH2:29][OH:30])[CH2:31][CH2:32]2)[n:33]1",
      "structure_id": "4e2440bf7a2bfb9211731f6ad37b7f25d07771ef5ee820d35a384ee91da1edc5",
      "standardization_version": "dilirank_parent_v1"
    },
    {
      "compound_id": "LT00607",
      "canonical_smiles": "Cc1cn(-c2cc(NC(=O)c3ccc(C)c(Nc4nccc(-c5cccnc5)n4)c3)cc(C(F)(F)F)c2)cn1",
      "atom_mapped_smiles": "[CH3:1][c:2]1[cH:3][n:4](-[c:5]2[cH:6][c:7]([NH:8][C:9](=[O:10])[c:11]3[cH:12][cH:13][c:14]([CH3:15])[c:16]([NH:17][c:18]4[n:19][cH:20][cH:21][c:22](-[c:23]5[cH:24][cH:25][cH:26][n:27][cH:28]5)[n:29]4)[cH:30]3)[cH:31][c:32]([C:33]([F:34])([F:35])[F:36])[cH:37]2)[cH:38][n:39]1",
      "structure_id": "649918665df879f51b6fb956254779ede685008b231aafd52e482f9d536b526e",
      "standardization_version": "dilirank_parent_v1"
    },
    {
      "compound_id": "LT02349",
      "canonical_smiles": "COc1cc(Nc2c(C#N)cnc3cc(OCCCN4CCN(C)CC4)c(OC)cc23)c(Cl)cc1Cl",
      "atom_mapped_smiles": "[CH3:1][O:2][c:3]1[cH:4][c:5]([NH:6][c:7]2[c:8]([C:9]#[N:10])[cH:11][n:12][c:13]3[cH:14][c:15]([O:16][CH2:17][CH2:18][CH2:19][N:20]4[CH2:21][CH2:22][N:23]([CH3:24])[CH2:25][CH2:26]4)[c:27]([O:28][CH3:29])[cH:30][c:31]23)[c:32]([Cl:33])[cH:34][c:35]1[Cl:36]",
      "structure_id": "9e96b99fe3feda8ecc843f24c0ccd17a10b91fc04f5db5c239901641ff2ef042",
      "standardization_version": "dilirank_parent_v1"
    }
  ]
}
